{
  "schema_version": "agent-pipeline-report-v2",
  "stage": "report",
  "status": "partial",
  "report": {
    "overview": "已核对1项重要事实：0项明确矛盾、1项证据不足或无法明确判定、0项明确吻合。本次处理未完整完成，见processing_issues。另有1项已过滤、0项仅保留为上下文，不独立核对。结论仅覆盖已提取并核对的事实，未保存设定。段内事件检查另发现0项矛盾、0项待确认。",
    "scope": "checked_events",
    "contradictions": [],
    "uncertainties": [
      {
        "finding_ids": [
          "R1"
        ],
        "event_ids": [
          "E1"
        ],
        "actors": [
          "林舟"
        ],
        "fact": "林舟独自留在封闭的实验室里",
        "reasons": [
          "这项事实与候选设定的对象或指代尚未明确对应，不能自行补入左右、身份等属性。"
        ],
        "citations": [],
        "reason_origin": "program_uncertainty_code",
        "uncertainty_code": "ambiguous_reference"
      }
    ],
    "confirmations": [],
    "possible_additions": [],
    "confirmation_topics": [
      {
        "finding_ids": [
          "R1"
        ],
        "event_ids": [
          "E1"
        ],
        "fact": "林舟独自留在封闭的实验室里",
        "question": "请核实适用设定及检索/判断结果，再决定是否建立新设定；不确定不等于新增设定。",
        "saved": false
      }
    ],
    "excluded_details": [
      {
        "event_id": "E2",
        "actors": [
          "林舟"
        ],
        "fact": "林舟此刻不在实验室，而在远方的车站",
        "reason": "呈现或操作过程细节，无独立核对价值",
        "role": "ignored",
        "required_by_event_ids": []
      }
    ],
    "processing_issues": [
      {
        "kind": "upstream_incomplete",
        "details": {
          "upstream_status": "ok",
          "failed_event_ids": [],
          "upstream_stages": {},
          "story_check": "段内检查失败或未完整完成，详见story_check"
        }
      },
      {
        "kind": "story_check_failure",
        "fact": "林舟独自留在封闭的实验室里 / 林舟此刻不在实验室，而在远方的车站",
        "detail": "故事引用不是对应原文"
      }
    ],
    "story_consistency": {
      "status": "partial",
      "scope": "current_story_observed_events",
      "pair_count": 1,
      "unprocessed_pair_count": 0,
      "contradictions": [],
      "uncertainties": []
    }
  },
  "summary": {
    "verdict": "uncertain",
    "label": "尚不能对已核对事实给出完整明确结论",
    "scope": "checked_events",
    "counts": {
      "consistent": 0,
      "contradiction": 0,
      "uncertain": 1,
      "failed": 0,
      "pending": 0,
      "ignored": 1,
      "support_only": 0,
      "unprocessed": 0
    },
    "checked_event_count": 1,
    "finding_count": 1
  },
  "findings": [
    {
      "id": "R1",
      "event_ids": [
        "E1"
      ],
      "actors": [
        "林舟"
      ],
      "event": "林舟独自留在封闭的实验室里",
      "verdict": "uncertain",
      "label": "不确定",
      "reasons": [
        "这项事实与候选设定的对象或指代尚未明确对应，不能自行补入左右、身份等属性。"
      ],
      "citations": [],
      "sources": [
        {
          "id": "S1",
          "text": "同一时刻，",
          "start": 0,
          "end": 5
        },
        {
          "id": "S2",
          "text": "林舟独自留在封闭的实验室里。",
          "start": 5,
          "end": 19
        }
      ],
      "contexts": [
        {
          "id": "S2",
          "text": "林舟独自留在封闭的实验室里。",
          "start": 5,
          "end": 19
        }
      ],
      "origin": "model",
      "assessment": {
        "same_subject": false,
        "evidence_applicable": null,
        "relation": "insufficient",
        "assumptions": []
      },
      "reason_origin": "program_uncertainty_code",
      "uncertainty_code": "ambiguous_reference"
    }
  ],
  "evidence": [],
  "failed_items": [],
  "pending_events": [],
  "ignored_events": [
    {
      "actors": [
        "林舟"
      ],
      "event": "林舟此刻不在实验室，而在远方的车站",
      "explicit": true,
      "modality": "observed",
      "source_ids": [
        "S3",
        "S4"
      ],
      "context_ids": [
        "S4"
      ],
      "mental_state": null,
      "conditions": [],
      "sources": [
        {
          "id": "S3",
          "text": "林舟此刻不在实验室，",
          "start": 19,
          "end": 29
        },
        {
          "id": "S4",
          "text": "而在远方的车站。",
          "start": 29,
          "end": 37
        }
      ],
      "contexts": [
        {
          "id": "S4",
          "text": "而在远方的车站。",
          "start": 29,
          "end": 37
        }
      ],
      "defaulted_fields": [
        "mental_state",
        "conditions"
      ],
      "id": "E2",
      "review_required": true,
      "review_reasons": [
        "optional_fields_defaulted"
      ]
    }
  ],
  "support_events": [],
  "unprocessed_events": [],
  "review_items": [
    {
      "event_id": "E1",
      "reasons": [
        "optional_fields_defaulted"
      ]
    },
    {
      "event_id": "E2",
      "reasons": [
        "optional_fields_defaulted"
      ]
    }
  ],
  "events": [
    {
      "actors": [
        "林舟"
      ],
      "event": "林舟独自留在封闭的实验室里",
      "explicit": true,
      "modality": "observed",
      "source_ids": [
        "S1",
        "S2"
      ],
      "context_ids": [
        "S2"
      ],
      "mental_state": null,
      "conditions": [],
      "sources": [
        {
          "id": "S1",
          "text": "同一时刻，",
          "start": 0,
          "end": 5
        },
        {
          "id": "S2",
          "text": "林舟独自留在封闭的实验室里。",
          "start": 5,
          "end": 19
        }
      ],
      "contexts": [
        {
          "id": "S2",
          "text": "林舟独自留在封闭的实验室里。",
          "start": 5,
          "end": 19
        }
      ],
      "defaulted_fields": [
        "mental_state",
        "conditions"
      ],
      "id": "E1",
      "review_required": true,
      "review_reasons": [
        "optional_fields_defaulted"
      ]
    },
    {
      "actors": [
        "林舟"
      ],
      "event": "林舟此刻不在实验室，而在远方的车站",
      "explicit": true,
      "modality": "observed",
      "source_ids": [
        "S3",
        "S4"
      ],
      "context_ids": [
        "S4"
      ],
      "mental_state": null,
      "conditions": [],
      "sources": [
        {
          "id": "S3",
          "text": "林舟此刻不在实验室，",
          "start": 19,
          "end": 29
        },
        {
          "id": "S4",
          "text": "而在远方的车站。",
          "start": 29,
          "end": 37
        }
      ],
      "contexts": [
        {
          "id": "S4",
          "text": "而在远方的车站。",
          "start": 29,
          "end": 37
        }
      ],
      "defaulted_fields": [
        "mental_state",
        "conditions"
      ],
      "id": "E2",
      "review_required": true,
      "review_reasons": [
        "optional_fields_defaulted"
      ]
    }
  ],
  "judge": {
    "schema_version": "agent-pipeline-judge-v1",
    "prompt_version": "judge-v6",
    "stage": "judge",
    "status": "partial",
    "events": [
      {
        "actors": [
          "林舟"
        ],
        "event": "林舟独自留在封闭的实验室里",
        "explicit": true,
        "modality": "observed",
        "source_ids": [
          "S1",
          "S2"
        ],
        "context_ids": [
          "S2"
        ],
        "mental_state": null,
        "conditions": [],
        "sources": [
          {
            "id": "S1",
            "text": "同一时刻，",
            "start": 0,
            "end": 5
          },
          {
            "id": "S2",
            "text": "林舟独自留在封闭的实验室里。",
            "start": 5,
            "end": 19
          }
        ],
        "contexts": [
          {
            "id": "S2",
            "text": "林舟独自留在封闭的实验室里。",
            "start": 5,
            "end": 19
          }
        ],
        "defaulted_fields": [
          "mental_state",
          "conditions"
        ],
        "id": "E1",
        "review_required": true,
        "review_reasons": [
          "optional_fields_defaulted"
        ]
      },
      {
        "actors": [
          "林舟"
        ],
        "event": "林舟此刻不在实验室，而在远方的车站",
        "explicit": true,
        "modality": "observed",
        "source_ids": [
          "S3",
          "S4"
        ],
        "context_ids": [
          "S4"
        ],
        "mental_state": null,
        "conditions": [],
        "sources": [
          {
            "id": "S3",
            "text": "林舟此刻不在实验室，",
            "start": 19,
            "end": 29
          },
          {
            "id": "S4",
            "text": "而在远方的车站。",
            "start": 29,
            "end": 37
          }
        ],
        "contexts": [
          {
            "id": "S4",
            "text": "而在远方的车站。",
            "start": 29,
            "end": 37
          }
        ],
        "defaulted_fields": [
          "mental_state",
          "conditions"
        ],
        "id": "E2",
        "review_required": true,
        "review_reasons": [
          "optional_fields_defaulted"
        ]
      }
    ],
    "items": [
      {
        "event_id": "E1",
        "event": {
          "actors": [
            "林舟"
          ],
          "event": "林舟独自留在封闭的实验室里",
          "explicit": true,
          "modality": "observed",
          "source_ids": [
            "S1",
            "S2"
          ],
          "context_ids": [
            "S2"
          ],
          "mental_state": null,
          "conditions": [],
          "sources": [
            {
              "id": "S1",
              "text": "同一时刻，",
              "start": 0,
              "end": 5
            },
            {
              "id": "S2",
              "text": "林舟独自留在封闭的实验室里。",
              "start": 5,
              "end": 19
            }
          ],
          "contexts": [
            {
              "id": "S2",
              "text": "林舟独自留在封闭的实验室里。",
              "start": 5,
              "end": 19
            }
          ],
          "defaulted_fields": [
            "mental_state",
            "conditions"
          ],
          "id": "E1",
          "review_required": true,
          "review_reasons": [
            "optional_fields_defaulted"
          ]
        },
        "evidence": [
          {
            "id": "0ad0e47151069e9d8676",
            "text": "雷在第三话向德尔塔说明双心脏与寄宿天使的秘密，德尔塔从此知道雷的宿主身份。",
            "file": "history.md",
            "start_line": 31,
            "end_line": 31,